name,url,description
Global Skills Development Report,https://www.shl.com/products/product-catalog/view/global-skills-development-report/,"Global Skills Development Report Description This report is designed to be given to individuals who have completed the Global Skills Assessment (GSA). With coverage across the Great 8 Domains, this measure of self-reported behaviors offers a complete overview of their current skills. Participants receive actionable tips on leveraging their top skill strengths and how they might develop their growth skills. Job levels Director, Entry-Level, Executive, General Population, Graduate, Manager, Mid-Professional, Front Line Manager, Supervisor, Test Type: A E B C D P"
.NET Framework 4.5,https://www.shl.com/products/product-catalog/view/net-framework-4-5/,".NET Framework 4.5 Description The.NET Framework 4.5 test measures knowledge of .NET environment. Designed for experienced users, this test covers the following topics: Application Development, Application Foundation, Data Modeling, Deployment, Diagnostics, Performance, Portability, and Security. Job levels Professional Individual Contributor, Mid-Professional, Languages English (USA), Assessment length Approximate Completion Time in minutes = 30 Test Type: K"
.NET MVC (New),https://www.shl.com/products/product-catalog/view/net-mvc-new/,".NET MVC (New) Description Multi-choice test that measures the knowledge of Model-View-Controller (MVC) architecture, validation, security, routing, and areas. Job levels Mid-Professional, Professional Individual Contributor, Languages English (USA), Assessment length Approximate Completion Time in minutes = 17 Test Type: K"
.NET MVVM (New),https://www.shl.com/products/product-catalog/view/net-mvvm-new/,".NET MVVM (New) Description Multi-choice test that measures the knowledge of MVVM pattern, scenarios, data validation, ViewModel communication and Quick-start. Job levels Mid-Professional, Professional Individual Contributor, Languages English (USA), Assessment length Approximate Completion Time in minutes = 5 Test Type: K"
.NET WCF (New),https://www.shl.com/products/product-catalog/view/net-wcf-new/,".NET WCF (New) Description Multi-choice test that measures the knowledge of .NET fundamentals, WCF architecture, programming model, SOA, managing and programming WCF. Job levels Mid-Professional, Professional Individual Contributor, Languages English (USA), Assessment length Approximate Completion Time in minutes = 11 Test Type: K"
.NET WPF (New),https://www.shl.com/products/product-catalog/view/net-wpf-new/,".NET WPF (New) Description Multi-choice test that measures the knowledge of .NET basics, WPF, XAML controls, events, layouts, working with WPF windows/menus and deploying WPF applications. Job levels Mid-Professional, Professional Individual Contributor, Languages English (USA), Assessment length Approximate Completion Time in minutes = 9 Test Type: K"
.NET XAML (New),https://www.shl.com/products/product-catalog/view/net-xaml-new/,".NET XAML (New) Description Multi-choice test that measures the knowledge of XAML triggers, data binding, custom controls and layouts. Job levels Mid-Professional, Professional Individual Contributor, Languages English (USA), Assessment length Approximate Completion Time in minutes = 5 Test Type: K"
Accounts Payable (New),https://www.shl.com/products/product-catalog/view/accounts-payable-new/,"Accounts Payable (New) Description Multiple-choice test that measures the knowledge of processing payables and vendor invoices, and the posting of journal entries. Job levels Entry-Level, Graduate, Mid-Professional, Professional Individual Contributor, Languages English (USA), Assessment length Approximate Completion Time in minutes = 9 Test Type: K"
Accounts Payable Simulation (New),https://www.shl.com/products/product-catalog/view/accounts-payable-simulation-new/,"Accounts Payable Simulation (New) Description Simulated data entry test that measures the ability to process payables and vendor invoices. Job levels Entry-Level, Graduate, Mid-Professional, Professional Individual Contributor, Languages English (USA), Assessment length Approximate Completion Time in minutes = 8 Test Type: S"
Accounts Receivable (New),https://www.shl.com/products/product-catalog/view/accounts-receivable-new/,"Accounts Receivable (New) Description Multiple-choice test that measures the knowledge of processing receivables and invoices. Job levels Entry-Level, Graduate, Mid-Professional, Professional Individual Contributor, Languages English (USA), Assessment length Approximate Completion Time in minutes = 13 Test Type: K"
Accounts Receivable Simulation (New),https://www.shl.com/products/product-catalog/view/accounts-receivable-simulation-new/,"Accounts Receivable Simulation (New) Description Simulated data entry test that measures the ability to process receivables and invoices. Job levels Entry-Level, Graduate, Mid-Professional, Professional Individual Contributor, Languages English (USA), Assessment length Approximate Completion Time in minutes = 8 Test Type: S"
ADO.NET (New),https://www.shl.com/products/product-catalog/view/ado-net-new/,"ADO.NET (New) Description Multi-choice test that measures the knowledge on the concepts of ADO.NET architecture, components and data provider objects. Job levels Mid-Professional, Professional Individual Contributor, Languages English (USA), Assessment length Approximate Completion Time in minutes = 10 Test Type: K"
Adobe Experience Manager (New),https://www.shl.com/products/product-catalog/view/adobe-experience-manager-new/,"Adobe Experience Manager (New) Description Multi-choice test that measures the knowledge of AEM components, templates, workflows, AEM collections, OSGi services and troubleshooting of AEM projects. Job levels Mid-Professional, Professional Individual Contributor, Languages English (USA), Assessment length Approximate Completion Time in minutes = 17 Test Type: K"
Adobe Photoshop CC,https://www.shl.com/products/product-catalog/view/adobe-photoshop-cc/,"Adobe Photoshop CC Description The Adobe Photoshop CC test measures knowledge of Adobe Photoshop CC. Designed for experienced users, this test covers the following topics: 3D, Color, File Management, Interface, Layers, Painting and Drawing, Retouch and Enhancements, Selection, Text, and Web. Job levels Mid-Professional, Professional Individual Contributor, Languages English (USA), Assessment length Approximate Completion Time in minutes = 20 Test Type: K"
Aeronautical Engineering (New),https://www.shl.com/products/product-catalog/view/aeronautical-engineering-new/,"Aeronautical Engineering (New) Description Multi-choice test that measures the knowledge of flight mechanics, space dynamics, aerodynamics, structures and propulsion. Job levels Graduate, Mid-Professional, Professional Individual Contributor, Languages English (USA), Assessment length Approximate Completion Time in minutes = 10 Test Type: K"
Aerospace Engineering (New),https://www.shl.com/products/product-catalog/view/aerospace-engineering-new/,"Aerospace Engineering (New) Description Multi-choice test that measures the conceptual knowledge of aerodynamics, aircraft systems and instrumentation, flight dynamics, space dynamics and avionics. Job levels Graduate, Mid-Professional, Professional Individual Contributor, Languages English (USA), Assessment length Approximate Completion Time in minutes = 10 Test Type: K"
Agile Software Development,https://www.shl.com/products/product-catalog/view/agile-software-development/,"Agile Software Development Description Multi-choice test that measures the knowledge of agile methodology, scrum, feature driven software development, incremental and iterative development and processes involved in agile software development. Job levels Graduate, Languages English (USA), Assessment length Approximate Completion Time in minutes = 7 minutes Test Type: K"
Agile Testing (New),https://www.shl.com/products/product-catalog/view/agile-testing-new/,"Agile Testing (New) Description Multi-choice test that measures the knowledge of tools, techniques and processes involved in the Agile testing methodology. Job levels Mid-Professional, Professional Individual Contributor, Languages English (USA), Assessment length Approximate Completion Time in minutes = 13 Test Type: K"
AI Skills,https://www.shl.com/products/product-catalog/view/ai-skills/,"AI Skills Description The AI Skills assessment measures the skills that help candidates successfully leverage AI in their work. Job levels General Population, Languages English (USA), Assessment length Approximate Completion Time in minutes = 16 Test Type: P"
Amazon Web Services (AWS) Development (New),https://www.shl.com/products/product-catalog/view/amazon-web-services-aws-development-new/,"Amazon Web Services (AWS) Development (New) Description Multi-choice test that measures the knowledge of AWS delivery process, monitoring, metrics, logging, security, validation and scalability. Job levels Mid-Professional, Professional Individual Contributor, Languages English (USA), Assessment length Approximate Completion Time in minutes = 6 Test Type: K"
Android Development (New),https://www.shl.com/products/product-catalog/view/android-development-new/,"Android Development (New) Description Multi-choice test that measures the knowledge of UI components for an Android device, services and alerts, animation and media apps, application components, security and testing. Job levels Mid-Professional, Professional Individual Contributor, Languages English (USA), Assessment length Approximate Completion Time in minutes = 7 Test Type: K"
Angular 6 (New),https://www.shl.com/products/product-catalog/view/angular-6-new/,"Angular 6 (New) Description Multi-choice test that measures the knowledge of the basic components and modules of Angular 6 and concepts like data binding, dependency injection, CRUD with HTTP, typescript, routing and navigation. Job levels Mid-Professional, Professional Individual Contributor, Languages English (USA), Assessment length Approximate Completion Time in minutes = 11 Test Type: K"
AngularJS (New),https://www.shl.com/products/product-catalog/view/angularjs-new/,"AngularJS (New) Description Multi-choice test that measures the knowledge of AngularJS architecture, forms, directives, filters, controllers, routing and testing. Job levels Mid-Professional, Professional Individual Contributor, Languages English (USA), Assessment length Approximate Completion Time in minutes = 9 Test Type: K"
Apache Hadoop (New),https://www.shl.com/products/product-catalog/view/apache-hadoop-new/,"Apache Hadoop (New) Description Multi-choice test that measures the knowledge of basic concepts of Hadoop, commands, HDFS and MapReduce. Job levels Mid-Professional, Professional Individual Contributor, Languages English (USA), Assessment length Approximate Completion Time in minutes = 7 Test Type: K"
Apache Hadoop Extensions (New),https://www.shl.com/products/product-catalog/view/apache-hadoop-extensions-new/,"Apache Hadoop Extensions (New) Description Multi-choice test that measures the conceptual knowledge of Pig, Hive and HBase. Job levels Mid-Professional, Professional Individual Contributor, Languages English (USA), Assessment length Approximate Completion Time in minutes = 9 Test Type: K"
Apache HBase (New),https://www.shl.com/products/product-catalog/view/apache-hbase-new/,"Apache HBase (New) Description Multi-choice test that measures the knowledge of HBase concepts such as CAP theorem, ACID properties, HBase client API, MapReduce integration, configuration and administration. Job levels Mid-Professional, Professional Individual Contributor, Languages English (USA), Assessment length Approximate Completion Time in minutes = 5 Test Type: K"
Apache Hive (New),https://www.shl.com/products/product-catalog/view/apache-hive-new/,"Apache Hive (New) Description Multi-choice test that measures the knowledge of Hive architecture, datatypes, built-in functions, configurations, partitioning, bucketing and commands of Hive query language. Job levels Mid-Professional, Professional Individual Contributor, Languages English (USA), Assessment length Approximate Completion Time in minutes = 5 Test Type: K"
Apache Kafka (New),https://www.shl.com/products/product-catalog/view/apache-kafka-new/,"Apache Kafka (New) Description Multi-choice test that measures the knowledge of Apache Kafka architecture, components, clusters, performance tuning and advanced operations. Job levels Mid-Professional, Professional Individual Contributor, Languages English (USA), Assessment length Approximate Completion Time in minutes = 6 Test Type: K"
Apache Pig (New),https://www.shl.com/products/product-catalog/view/apache-pig-new/,"Apache Pig (New) Description Multi-choice test that measures the knowledge of Pig architecture, built-in operators, built-in functions and commands in PigLatin. Job levels Mid-Professional, Professional Individual Contributor, Languages English (USA), Assessment length Approximate Completion Time in minutes = 6 Test Type: K"
Apache Spark (New),https://www.shl.com/products/product-catalog/view/apache-spark-new/,"Apache Spark (New) Description Multi-choice test that measures the knowledge of Apache Spark principles, RDD operations - actions and transformations, lineage graphs and lazy evaluation. Job levels Mid-Professional, Professional Individual Contributor, Languages English (USA), Assessment length Approximate Completion Time in minutes = 8 Test Type: K"
ASP .NET with C# (New),https://www.shl.com/products/product-catalog/view/asp-net-with-c-new/,"ASP .NET with C# (New) Description Multi-choice test that measures the knowledge of .NET framework and controls, C# fundamentals, OOPs concepts and advanced topics such as data access components, state management and security services. Job levels Mid-Professional, Professional Individual Contributor, Languages English (USA), Assessment length Approximate Completion Time in minutes = 13 Test Type: K"
ASP.NET 4.5,https://www.shl.com/products/product-catalog/view/asp-net-4-5/,"ASP.NET 4.5 Description The ASP.NET 4.5 test measures knowledge of programming in the ASP.NET environment. Designed for experienced developers, but an average performer in this role should pass this test. This test includes the following topics: .NET Framework, Client-Side Programming, Data Access, Enhanced Runtime Features, Portals, Services and Mobile, Security, Troubleshooting and Optimization, Web Applications, and Web Forms. Job levels Mid-Professional, Professional Individual Contributor, Languages English (USA), Assessment length Approximate Completion Time in minutes = 30 Test Type: K"
Assessment and Development Center Exercises,https://www.shl.com/products/product-catalog/view/assessment-and-development-center-exercises/,"Assessment and Development Center Exercises Description SHL offers a comprehensive range of Assessment and Development Centre exercise in digital format, for remote assessment through our Virtual Assessment and Development Centre platform. We offer a wide range of exercise types including group exercise, role plays, analysis presentations and written exercises. Exercises are available across a wide range of job levels and industry contexts. Contact SHL to find out more. Job levels Director, Entry-Level, Executive, Front Line Manager, General Population, Graduate, Manager, Mid-Professional, Professional Individual Contributor, Supervisor, Languages English International, English (USA), Assessment length Approximate Completion Time in minutes = Variable Test Type: E"
Automata - Fix (New),https://www.shl.com/products/product-catalog/view/automata-fix-new/,"Automata - Fix (New) Description A simulated compiler integrated test to measure debugging skills in C, C++ and Java. The test checks the ability to fix logical or syntactical errors and to reuse an existing code. Your use of this assessment product may be subject to New York City Law 144 (Regulation of the Use of Automated Employment Decision Tools) (dated July 5, 2023). Compliance with Law 144 is your responsibility.
Read more on https://www.shl.com/legal/shl-us-regulatory-compliance/ Job levels Mid-Professional, Languages English (USA), Assessment length Approximate Completion Time in minutes = max 20 Test Type: S"
Automata - SQL (New),https://www.shl.com/products/product-catalog/view/automata-sql-new/,"Automata - SQL (New) Description A simulated query writing test that measures the ability to write SQL queries to perform DDL, DML and DCL tasks. Job levels Mid-Professional, Professional Individual Contributor, Languages English (USA), Assessment length Approximate Completion Time in minutes = max 30 Test Type: S"
Automata (New),https://www.shl.com/products/product-catalog/view/automata-new/,"Automata (New) Description An AI-powered coding simulation assessment that evaluates candidate’s programming ability. Offers a familiar IDE environment available in over 40 different programming languages and tests candidates using real-world coding problems. Your use of this assessment product may be subject to New York City Law 144 (Regulation of the Use of Automated Employment Decision Tools) (dated July 5, 2023). Compliance with Law 144 is your responsibility.
Read more on https://www.shl.com/legal/shl-us-regulatory-compliance/ Job levels Mid-Professional, Professional Individual Contributor, Languages English (USA), Assessment length Approximate Completion Time in minutes = max 45 Test Type: S"
Automata Data Science (New),https://www.shl.com/products/product-catalog/view/automata-data-science-new/,"Automata Data Science (New) Description A simulated test that measures the ability to analyze and modify data using machine learning algorithms to obtain desirable results. Job levels Mid-Professional, Professional Individual Contributor, Languages English (USA), Assessment length Approximate Completion Time in minutes = max 60 Test Type: S"
Automata Data Science Pro (New),https://www.shl.com/products/product-catalog/view/automata-data-science-pro-new/,"Automata Data Science Pro (New) Description A simulated test that measures the ability to analyze and modify data using machine learning algorithms to obtain desirable results. Job levels Professional Individual Contributor, Mid-Professional, Languages English (USA), Assessment length Approximate Completion Time in minutes = max 60 Test Type: S"
Automata Front End,https://www.shl.com/products/product-catalog/view/automata-front-end/,"Automata Front End Description Simulation based test that measures the front-end development capabilities using HTML, CSS, and
JavaScript. The candidate is provided with 3 different sections to code in HTML, CSS and JavaScript respectively and a separate output section to view the output. This simulation is then manually scored. Job levels Entry-Level, Graduate, Mid-Professional, Professional Individual Contributor, Manager, Languages English (USA), Assessment length Approximate Completion Time in minutes = 30 minutes Test Type: S"
Automata Pro (New),https://www.shl.com/products/product-catalog/view/automata-pro-new/,"Automata Pro (New) Description An AI-powered coding simulation assessment that evaluates candidate’s programming ability. Offers a familiar IDE environment available in over 40 different programming languages and tests candidates using real-world coding problems. Your use of this assessment product may be subject to New York City Law 144 (Regulation of the Use of Automated Employment Decision Tools) (dated July 5, 2023). Compliance with Law 144 is your responsibility.
Read more on https://www.shl.com/legal/shl-us-regulatory-compliance/ Job levels Mid-Professional, Professional Individual Contributor, Languages English (USA), Assessment length Approximate Completion Time in minutes = max 60 Test Type: S"
Automata Selenium,https://www.shl.com/products/product-catalog/view/automata-selenium/,"Automata Selenium Description A coding simulation assessment that evaluates the ability to conduct tasks related to automation testing using Selenium scripts. Job levels Entry-Level, Graduate, Manager, Mid-Professional, Professional Individual Contributor, Languages English (USA), Assessment length Approximate Completion Time in minutes = 60 Test Type: S"
Automation Anywhere RPA Development (New),https://www.shl.com/products/product-catalog/view/automation-anywhere-rpa-development-new/,"Automation Anywhere RPA Development (New) Description Multi-choice test that measures the knowledge of Automation Anywhere dash board and task editor, control room, key commands, bots and Automation Anywhere client. Job levels Mid-Professional, Professional Individual Contributor, Languages English (USA), Assessment length Approximate Completion Time in minutes = 8 Test Type: K"
Automotive Engineering (New),https://www.shl.com/products/product-catalog/view/automotive-engineering-new/,"Automotive Engineering (New) Description Multi-choice test that measures the knowledge of auto engine classification, engine fuel system, auto-vehicle technology, maintenance, inspection and troubleshooting. Job levels Graduate, Mid-Professional, Professional Individual Contributor, Languages English (USA), Assessment length Approximate Completion Time in minutes = 13 Test Type: K"
Basic Biology (New),https://www.shl.com/products/product-catalog/view/basic-biology-new/,"Basic Biology (New) Description Multi choice test that measures the candidate's basic understanding of Biology. Job levels Professional Individual Contributor, Graduate, Mid-Professional, Languages English (USA), Assessment length Approximate Completion Time in minutes = 6 Test Type: K"
Basic Computer Literacy (Windows 10) (New),https://www.shl.com/products/product-catalog/view/basic-computer-literacy-windows-10-new/,"Basic Computer Literacy (Windows 10) (New) Description The Basic Computer Literacy (Windows 10) simulation measures knowledge of general computer terminology, processes, and applications and the ability to perform certain operations in a simulated environment resembling the actual application. This simulation consists of both multiple choice and simulation-based questions, and includes the following topics: Application Software, Computer Terms, Internet and Email, Managing Files, Operating System, and Parts of the Computer. Job levels Entry-Level, Languages English (USA), Assessment length Approximate Completion Time in minutes = 30 Test Type: S K"
Basic Statistics (New),https://www.shl.com/products/product-catalog/view/basic-statistics-new/,"Basic Statistics (New) Description Multi-choice test that measures the knowledge of statistical methods, exploratory analysis, basics of probability, standard distributions and statistical testing. Job levels Graduate, Mid-Professional, Professional Individual Contributor, Languages English (USA), Assessment length Approximate Completion Time in minutes = 10 Test Type: K"
Biochemistry (New),https://www.shl.com/products/product-catalog/view/biochemistry-new/,"Biochemistry (New) Description Multi-choice test that measures the knowledge of various bio-molecules like amino acids, proteins, enzymes, carbohydrates, vitamins and nucleic acids, and concepts of bioenergetics and metabolism. Job levels Graduate, Mid-Professional, Professional Individual Contributor, Languages English (USA), Assessment length Approximate Completion Time in minutes = 8 Test Type: K"
Biotech Lab Techniques (New),https://www.shl.com/products/product-catalog/view/biotech-lab-techniques-new/,"Biotech Lab Techniques (New) Description Multi-choice test that measures the knowledge of biophysical techniques, bio-processing and separation techniques like chromatography and electrophoresis. Job levels Graduate, Professional Individual Contributor, Mid-Professional, Languages English (USA), Assessment length Approximate Completion Time in minutes = 5 Test Type: K"
BizTalk (New),https://www.shl.com/products/product-catalog/view/biztalk-new/,"BizTalk (New) Description Multi-choice test that measures the knowledge of BizTalk architecture, pipelines, adapters, business process techniques and BizTalk administration. Job levels Mid-Professional, Professional Individual Contributor, Languages English (USA), Assessment length Approximate Completion Time in minutes = 16 Test Type: K"
Business Communication (adaptive),https://www.shl.com/products/product-catalog/view/business-communication-adaptive/,"Business Communication (adaptive) Description This is an adaptive test that measures knowledge of communicating in the workplace. It measures the skills necessary to communicate effectively with coworkers at all levels and with external business contacts. Designed for the average business worker, this test includes the following topics: Electronic Communication, Employment Communication, Listening, Meetings, Nonverbal Communication, Verbal Communication, and Written Communication. Job levels Entry-Level, Front Line Manager, Manager, Mid-Professional, Professional Individual Contributor, Languages English (USA), Assessment length Approximate Completion Time in minutes = 24 Test Type: K"
Business Communications,https://www.shl.com/products/product-catalog/view/business-communications/,"Business Communications Description This test measures the candidate's knowledge of communicating in the workplace.  It measures the skills necessary to communicate effectively with coworkers at all levels and with external business contacts. Designed for the average business worker, this test includes the following topics: Electronic Communication, Employment Communication, Listening, Meetings, Nonverbal Communication, Verbal Communication, and Written Communication. This version of the test is not adaptive. Languages English (USA), Assessment length Approximate Completion Time in minutes = 35 Test Type: K"
