name,url,description
Manufac. & Indust. - Mechanical & Vigilance 8.0,https://www.shl.com/products/product-catalog/view/mechanical-and-vigilance-focus-8-0/,"Manufac. & Indust. - Mechanical & Vigilance 8.0 Description The Manufacturing & Industrial Mechanical & Vigilance Focus 8.0 Job-Focused Assessment
measures the behaviors that underlie successful and safe performance in an
industrial/manufacturing setting. This solution assesses process monitoring, mechanical
comprehension and other foundational behaviors including behaving safely in the workplace;
applying domain-related expertise; offering practical solutions; and attending to multiple tasks.
Potential job titles that use this solution include: Machine and Equipment Operators,
Assemblers and Fitters, Maintenance/Repair Workers, Surveillance, and Quality Assurance
Workers. Job levels Entry-Level, Graduate, Manager, Mid-Professional, Professional Individual Contributor, Languages English (USA), Assessment length Approximate Completion Time in minutes = 49 Test Type: A P"
Manufac. & Indust. - Safety & Dependability 8.0,https://www.shl.com/products/product-catalog/view/safety-and-dependability-focus-8-0/,"Manufac. & Indust. - Safety & Dependability 8.0 Description The Manufacturing & Industrial Safety & Dependability Focus 8.0 Job-Focused Assessment
measures the behaviors that underlie safe performance in a work setting. This solution
assesses foundational behaviors including behaving safely in the workplace; complying with
rules and regulations; applying domain-related expertise; and attending to multiple tasks.
Potential job titles that use this solution include: Machine and Equipment Operators,
Laborers/Warehouse Workers, Assemblers & Fitters, Maintenance/Repair Workers,
Dispatchers, Surveillance, Quality Assurance Workers, Material Handlers, and Truck/Ship
Loaders Job levels Entry-Level, Graduate, Manager, Mid-Professional, Professional Individual Contributor, Languages English (USA), German, Latin American Spanish, French, English International, Chinese Simplified, Italian, Japanese, Assessment length Approximate Completion Time in minutes = 16 Test Type: P"
Manufacturing & Industrial - Essential Focus 8.0,https://www.shl.com/products/product-catalog/view/essential-focus-8-0/,"Manufacturing & Industrial - Essential Focus 8.0 Description The Manufacturing & Industrial Essential 8.0 Job-Focused Assessment measures the behaviors
that underlie successful and safe performance in an industrial/manufacturing setting. This
solution assesses foundational behaviors including behaving safely in the workplace; applying
domain-related expertise; offering practical solutions; and attending to multiple tasks.
Potential job titles that use this solution include: Machining and Equipment Operators,
Laborer/Warehouse, Assemblers and Fitters, Maintenance/Repair Workers, Dispatchers,
Surveillance, Quality Assurance Workers, Material Handlers, and Truck/Ship Loaders. Job levels Mid-Professional, Professional Individual Contributor, Entry-Level, Graduate, Manager, Languages English International, French, English (USA), Chinese Simplified, Italian, Japanese, Latin American Spanish, German, Assessment length Approximate Completion Time in minutes = 16 Test Type: P"
Manufacturing & Industrial - Mechanical Focus 8.0,https://www.shl.com/products/product-catalog/view/mechanical-focus-8-0/,"Manufacturing & Industrial - Mechanical Focus 8.0 Description The Manufacturing & Industrial Mechanical Focus 8.0 Job-Focused Assessment measures the
behaviors that underlie successful and safe performance in an industrial/manufacturing
setting. This solution assesses mechanical comprehension and other foundational behaviors
including behaving safely in the workplace; applying domain-related expertise; offering
practical solutions; and attending to multiple tasks.
Potential job titles that use this solution include: Machine and Equipment Operators,
Assemblers and Fitters, and Maintenance/Repair Workers. Job levels Entry-Level, Graduate, Manager, Mid-Professional, Professional Individual Contributor, Languages English (USA), English International, Italian, Japanese, Latin American Spanish, Chinese Simplified, Assessment length Approximate Completion Time in minutes = 31 Test Type: A P"
Manufacturing & Industrial - Vigilance Focus 8.0,https://www.shl.com/products/product-catalog/view/vigilance-focus-8-0/,"Manufacturing & Industrial - Vigilance Focus 8.0 Description The Manufacturing and Industrial Vigilance Focus 8.0 Job-Focused Assessment measures the
behaviors that underlie successful and safe performance in an industrial/manufacturing
setting. This solution assesses process monitoring and other foundational behaviors including
behaving safely in the workplace; applying domain-related expertise; offering practical
solutions; and attending to multiple tasks.
Potential job titles that use this solution include: Machine and Equipment Operators,
Assemblers & Fitters, Maintenance/ Repair Workers, Dispatchers, Surveillance, Quality
Assurance Workers Job levels Entry-Level, Mid-Professional, Professional Individual Contributor, Graduate, Manager, Languages English (USA), Assessment length Approximate Completion Time in minutes = 34 Test Type: A P"
Marketing (New),https://www.shl.com/products/product-catalog/view/marketing-new/,"Marketing (New) Description Multi-choice test that measures the conceptual knowledge of marketing principles, market research, consumer behavior, brand management, sales management, channel management and advertisement management. Job levels Graduate, Manager, Mid-Professional, Professional Individual Contributor, Supervisor, Languages English (USA), Assessment length Approximate Completion Time in minutes = 9 Test Type: K"
Maven (New),https://www.shl.com/products/product-catalog/view/maven-new/,"Maven (New) Description Multi-choice test that measures the knowledge of Maven installation, dependencies, Project Object Model (POM), builds and plugins. Job levels Mid-Professional, Professional Individual Contributor, Languages English (USA), Assessment length Approximate Completion Time in minutes = 7 Test Type: K"
Mechanical Engineering (New),https://www.shl.com/products/product-catalog/view/mechanical-engineering-new/,"Mechanical Engineering (New) Description Multi-choice test that measures the conceptual knowledge of fluid and machine mechanics, thermodynamics, IC engines and manufacturing science. Job levels Graduate, Mid-Professional, Professional Individual Contributor, Languages English (USA), Assessment length Approximate Completion Time in minutes = 7 Test Type: K"
Mechatronics Engineering (New),https://www.shl.com/products/product-catalog/view/mechatronics-engineering-new/,"Mechatronics Engineering (New) Description Multi-choice test that measures the knowledge related to basic mechatronics systems, components, sensors, feedback devices, control elements, actuators, computational elements and application of mechatronic systems. Job levels Graduate, Mid-Professional, Professional Individual Contributor, Languages English (USA), Assessment length Approximate Completion Time in minutes = 19 Test Type: K"
Medical Terminology (New),https://www.shl.com/products/product-catalog/view/medical-terminology-new/,"Medical Terminology (New) Description Multi-choice test that measures the knowledge of different medical terms and abbreviations related to the human body, diseases and diagnosis. Job levels Graduate, Mid-Professional, Professional Individual Contributor, Languages English (USA), Assessment length Approximate Completion Time in minutes = 3 Test Type: K"
Metallurgical Engineering (New),https://www.shl.com/products/product-catalog/view/metallurgical-engineering-new/,"Metallurgical Engineering (New) Description Multi-choice test that measures the knowledge of process metallurgy, industrial metallurgy and physical metallurgy. Job levels Graduate, Manager, Mid-Professional, Professional Individual Contributor, Supervisor, Languages English (USA), Assessment length Approximate Completion Time in minutes = 10 Test Type: K"
MFS 360 Enterprise Leadership Report,https://www.shl.com/products/product-catalog/view/mfs-360-enterprise-leadership-report/,"MFS 360 Enterprise Leadership Report Description The layout of this report follows the standard MFS 360 report but this is based on the Enterprise Leadership competency model, not the UCF model. The report text has been updated as well to reflect that. Test Type: D"
MFS 360 UCF Group Report,https://www.shl.com/products/product-catalog/view/mfs-360-ucf-group-report/,"MFS 360 UCF Group Report Description This report follows the standard layout of the 360 report but incorporates the average scores for a group of participants. The report can be generated for all participants on a project, or a dedicated group can be created in MFS for a group that includes participants across multiple projects. The report does not include the open questions even when they were part of the questionnaire. Developments tips are not available in this report. Test Type: D"
MFS 360 UCF Performance Potential Dev Tips Report,https://www.shl.com/products/product-catalog/view/mfs-360-ucf-performance-potential-dev-tips-report/,"MFS 360 UCF Performance Potential Dev Tips Report Description This report is more or less identical to the standard MFS report but with an additional section that looks at the performance versus the potential and plots the competencies on a four field grid to identify developed strengths, natural strengths, development need, or untapped potential.  The report text has been updated to reflect the inclusion of the OPQ, and the potential is also shown in the competency summary part of the report. The OPQ scores that feed into this report will need to be uploaded into MFS using an upload sheet based on a score extract from SODA or TC. This particular example report also includes development tips which are an optional extra. Test Type: D"
MFS 360 UCF Standard Report,https://www.shl.com/products/product-catalog/view/mfs-360-ucf-standard-report/,"MFS 360 UCF Standard Report Description This is the default MFS report. It is based on the UCF20 competency model. The report will only show those scales that were selected as part of the questionnaire setup. The importance rating, open questions and multiple choice questions are optional parts of the questionnaire. Only if those parts were added to the questionnaire will they show in the report. Open and multiple Choice questions are of the clients’ own design. The example report here does not include developments tips, but those can be added if requested (see performance and potential report for examples of that). Test Type: D"
Micro Focus Unified Functional Testing (New),https://www.shl.com/products/product-catalog/view/micro-focus-unified-functional-testing-new/,"Micro Focus Unified Functional Testing (New) Description Multi-choice test that measures the knowledge of automation testing using the QTP tool. Job levels Mid-Professional, Professional Individual Contributor, Languages English (USA), Assessment length Approximate Completion Time in minutes = 12 Test Type: K"
Microservices (New),https://www.shl.com/products/product-catalog/view/microservices-new/,"Microservices (New) Description Multi-choice test that measures the knowledge of Microservices architecture, SOA, and Microservices patterns. Job levels Mid-Professional, Professional Individual Contributor, Languages English (USA), Assessment length Approximate Completion Time in minutes = 7 Test Type: K"
Microsoft Dynamics Development (New),https://www.shl.com/products/product-catalog/view/microsoft-dynamics-development-new/,"Microsoft Dynamics Development (New) Description Multi-choice test that measures the knowledge of Microsoft Dynamics installation, sales process, service management, administration, configuration, entity model, workflows, dialogs, solutions, CRM web services and plugins. Job levels Mid-Professional, Professional Individual Contributor, Languages English (USA), Assessment length Approximate Completion Time in minutes = 9 Test Type: K"
Microsoft Excel 365 - Essentials (New),https://www.shl.com/products/product-catalog/view/microsoft-excel-365-essentials-new/,"Microsoft Excel 365 - Essentials (New) Description The Microsoft Excel 365 - Essentials simulation evaluates ability to perform certain operations in a simulated environment of MS Excel, and includes the following topics: Applying Formulas and Functions, Creating and Analyzing Data, Formatting Cells, Data, and Content, Managing Workbooks and Worksheets, Presenting Data Visually, Printing and Views, and Sharing, Maintaining, and Securing Workbooks. Job levels Entry-Level, Languages English (USA), Assessment length Approximate Completion Time in minutes = 30 Test Type: K S"
Microsoft Excel 365 (New),https://www.shl.com/products/product-catalog/view/microsoft-excel-365-new/,"Microsoft Excel 365 (New) Description The Microsoft Excel 365 simulation evaluates ability to perform certain operations in a simulated environment of MS Excel, and includes the following topics: Applying Formulas and Functions, Creating and Analyzing Data, Formatting Cells, Data, and Content, Managing Workbooks and Worksheets, Presenting Data Visually, Printing and Views, and Sharing, Maintaining, and Securing Workbooks. Job levels Entry-Level, Languages English (USA), Assessment length Approximate Completion Time in minutes = 35 Test Type: K S"
Microsoft Outlook 2013 (adaptive),https://www.shl.com/products/product-catalog/view/microsoft-outlook-2013-adaptive/,"Microsoft Outlook 2013 (adaptive) Description The Microsoft Outlook 2013 (adaptive) test measures knowledge of Microsoft Outlook 2013. Designed for professionals, this test includes the following topics: Application Management, Contacts and Address Books, Mail Management, Messages and Message Organization, Notes, Printing, Schedules and Calendars, Security, and Tasks. Job levels Mid-Professional, Professional Individual Contributor, Languages English (USA), Assessment length Approximate Completion Time in minutes = 25 Test Type: K"
Microsoft PowerPoint 365 - Essentials (New),https://www.shl.com/products/product-catalog/view/microsoft-powerpoint-365-essentials-new/,"Microsoft PowerPoint 365 - Essentials (New) Description The Microsoft PowerPoint 365 - Essentials simulation evaluates ability to perform certain operations in a simulated environment of Microsoft PowerPoint, and includes the following topics: Applying Transitions and Animations, Creating, Managing, and Saving Presentations, Formatting Presentation Content, Reviewing, Collaborating, and Delivering Presentations, and Working with Multimedia Elements, Images, and Illustrations. Job levels Entry-Level, Languages English (USA), Assessment length Approximate Completion Time in minutes = 25 Test Type: K S"
Microsoft SQL Server 2014 Programming,https://www.shl.com/products/product-catalog/view/microsoft-sql-server-2014-programming/,"Microsoft SQL Server 2014 Programming Description The Microsoft SQL Server 2014 Programming test measures knowledge of Microsoft Structure Query Language (SQL) Server 2014 Programming. Designed for experienced database programmers, this test covers the following topics: Beyond Relational, Control Flow, Data Types and NULL, Database Design, Developer Tools, Modifying Data, Running Queries, and Writing Queries. Job levels Mid-Professional, Professional Individual Contributor, Languages English (USA), Assessment length Approximate Completion Time in minutes = 35 Test Type: K"
Microsoft Windows Server 2012 Administration,https://www.shl.com/products/product-catalog/view/microsoft-windows-server-2012-administration/,"Microsoft Windows Server 2012 Administration Description The Microsoft Windows Server 2012 Administration test measures knowledge of Windows Server Administration. Designed for experienced Network Administrators, this test includes the following topics: Active Directory, Administrative Tasks, Computer Properties, Configuration and Management, Design and Installation, Local Security Policy, Networking, Security, and Server Management. Job levels Mid-Professional, Professional Individual Contributor, Languages English (USA), Assessment length Approximate Completion Time in minutes = 35 Test Type: K"
Microsoft Word 365 - Essentials (New),https://www.shl.com/products/product-catalog/view/microsoft-word-365-essentials-new/,"Microsoft Word 365 - Essentials (New) Description The Microsoft Word 365 - Essentials simulation evaluates ability to perform certain operations in a simulated environment of Microsoft Word, and includes the following topics: Applying Illustrations and Graphics, Applying Page Layout, Creating Content, Creating, Printing, and Saving Documents, Formatting Content, Proofreading Documents and Reviewing, Maintaining, and Securing Documents. Job levels Entry-Level, Languages English (USA), Assessment length Approximate Completion Time in minutes = 25 Test Type: K S"
Microsoft Word 365 (New),https://www.shl.com/products/product-catalog/view/microsoft-word-365-new/,"Microsoft Word 365 (New) Description The Microsoft Word 365 simulation evaluates ability to perform certain operations in a simulated environment of Microsoft Word, and includes the following topics: Applying Illustrations and Graphics, Applying Page Layout, Creating Content, Creating, Printing, and Saving Documents, Formatting Content, Proofreading Documents and Reviewing, Maintaining, and Securing Documents. Job levels Entry-Level, Languages English (USA), Assessment length Approximate Completion Time in minutes = 35 Test Type: S K"
Mineral Engineering (New),https://www.shl.com/products/product-catalog/view/mineral-engineering-new/,"Mineral Engineering (New) Description Multi-choice test that measures the knowledge of comminution and classification, physical separation process, particle technology, metallurgical thermodynamics, mineralogy, petrology and stratigraphy. Job levels Graduate, Manager, Mid-Professional, Professional Individual Contributor, Supervisor, Languages English (USA), Assessment length Approximate Completion Time in minutes = 12 Test Type: K"
Mining Engineering (New),https://www.shl.com/products/product-catalog/view/mining-engineering-new/,"Mining Engineering (New) Description Multi-choice test that measures the knowledge of mining methods, mineral processing, mining machinery, mineralogy, petrology and stratigraphy. Job levels Graduate, Manager, Mid-Professional, Professional Individual Contributor, Supervisor, Languages English (USA), Assessment length Approximate Completion Time in minutes = 16 Test Type: K"
Mobility (New),https://www.shl.com/products/product-catalog/view/mobility-new/,"Mobility (New) Description Multi-choice test that measures the knowledge on topics related to mobility and mobile computing. Job levels Mid-Professional, Professional Individual Contributor, Languages English (USA), Assessment length Approximate Completion Time in minutes = 9 Test Type: K"
Molecular Biology (New),https://www.shl.com/products/product-catalog/view/molecular-biology-new/,"Molecular Biology (New) Description Multi-choice test that measures the knowledge of molecular genetics, transgenics, rDNA technology, chromosomal genetics, transformation and related processes. Job levels Graduate, Mid-Professional, Professional Individual Contributor, Languages English (USA), Assessment length Approximate Completion Time in minutes = 6 Test Type: K"
MongoDB (New),https://www.shl.com/products/product-catalog/view/mongodb-new/,"MongoDB (New) Description Multi-choice test that measures the conceptual knowledge of MongoDB like sharding, replication, indexing, security and storage. It also checks the knowledge of MongoDB queries and data models. Job levels Mid-Professional, Professional Individual Contributor, Languages English (USA), Assessment length Approximate Completion Time in minutes = 7 Test Type: K"
Motivation Questionnaire MQM5,https://www.shl.com/products/product-catalog/view/motivation-questionnaire-mqm5/,"Motivation Questionnaire MQM5 Description By understanding what motivates their staff, managers can unlock each individual’s full potential and direct their energies more constructively. This questionnaire measures 18 dimensions of an individual’s motivation, and provides a comprehensive understanding of those situations which increase and reduce their motivation. Job levels Director, Entry-Level, Executive, Front Line Manager, General Population, Graduate, Manager, Mid-Professional, Professional Individual Contributor, Supervisor, Languages Latin American Spanish, Portuguese (Brazil), Latvian, Danish, Indonesian, Swedish, Turkish, Portuguese, French (Canada), Japanese, Chinese Traditional, Flemish, French (Belgium), Spanish, Finnish, French, German, Greek, Italian, Polish, Romanian, Russian, English International, English (USA), Chinese Simplified, Dutch, Hungarian, Norwegian, Czech, Slovak, English (Australia), Arabic, Korean, Assessment length Approximate Completion Time in minutes = Untimed, approx. 25 Test Type: P"
MQ Candidate Motivation Report,https://www.shl.com/products/product-catalog/view/mq-candidate-motivation-report/,"MQ Candidate Motivation Report Description The Candidate Motivation Report is designed as a feedback report for the individual. It provides an in-depth and easy-to-understand evaluation of an individuals motivators and demotivators at work. Job levels Director, Entry-Level, Executive, Front Line Manager, General Population, Graduate, Manager, Mid-Professional, Professional Individual Contributor, Supervisor, Languages English International, English (USA), Chinese Simplified, Test Type: P"
MQ Employee Motivation Report,https://www.shl.com/products/product-catalog/view/mq-employee-motivation-report/,"MQ Employee Motivation Report Description The MQ Employee Motivation Report is ideal for use by line managers and those concerned with employee’s performance and well being, the Employee Motivation Report provides an in-depth and easy-to-understand evaluation of what motivates and de-motivates someone. It also offers a comprehensive list of tips and suggestions for managing the employee’s strongest motivators and demotivators. Job levels Director, Entry-Level, Executive, Front Line Manager, General Population, Graduate, Manager, Mid-Professional, Professional Individual Contributor, Supervisor, Languages Chinese Simplified, English International, English (USA), Test Type: P"
MQ Motivation Report Pack,https://www.shl.com/products/product-catalog/view/mq-motivation-report-pack/,"MQ Motivation Report Pack Description The MQ Report pack consists of the Profile Chart, Employee Motivation Report and the Candidate Report and is a cost effective way of ensuring that your organisation takes a comprehensive approach to understanding what motivates its employees. Job levels General Population, Graduate, Manager, Mid-Professional, Professional Individual Contributor, Supervisor, Director, Entry-Level, Executive, Front Line Manager, Languages Chinese Simplified, English International, English (USA), Test Type: P"
MQ Profile,https://www.shl.com/products/product-catalog/view/mq-profile/,"MQ Profile Description The profile chart is the Sten score graphical output of the MQ. It clearly shows the individual’s motivational drivers compared to the selected norm group as well as highlighting any unique scores. Please note this report is currently being updated on Talent Central as part of a reporting refresh project, and there may be visual differences when comparing Talent Central reports to ones generated on other assessment platforms. Differences are regarding the layout and display of the reports only and do not affect the underlying scoring. When viewing sample reports, please ensure you select the appropriate language and platform example. Where a sample report has no platform indicated, it is available on both the Talent Central and SODA platforms. Job levels Director, Entry-Level, Executive, Front Line Manager, General Population, Graduate, Manager, Mid-Professional, Professional Individual Contributor, Supervisor, Languages Flemish, French (Belgium), Spanish, Danish, Dutch, Finnish, French (Canada), French, German, Greek, Italian, Norwegian, Polish, Portuguese, Russian, Swedish, English International, English (USA), Romanian, Indonesian, Turkish, Chinese Simplified, Hungarian, Test Type: P"
MS Access (New),https://www.shl.com/products/product-catalog/view/ms-access-new/,"MS Access (New) Description Multi-choice test that measures the knowledge and basic understanding of MS Access programming. Job levels Entry-Level, Graduate, Manager, Mid-Professional, Professional Individual Contributor, Supervisor, Languages English (USA), Assessment length Approximate Completion Time in minutes = 7 Test Type: K"
MS Excel (New),https://www.shl.com/products/product-catalog/view/ms-excel-new/,"MS Excel (New) Description Multi-choice test that measures the ability to use MS Excel to maintain, organize, analyze and present numeric data. Job levels Entry-Level, Graduate, Manager, Mid-Professional, Professional Individual Contributor, Supervisor, Languages English (USA), Spanish, French, Portuguese (Brazil), Assessment length Approximate Completion Time in minutes = 6 Test Type: K"
MS Office Basic Computer Literacy (New),https://www.shl.com/products/product-catalog/view/ms-office-basic-computer-literacy-new/,"MS Office Basic Computer Literacy (New) Description Multi-choice test that measures the ability to use MS Word, MS Excel and MS PowerPoint to perform basic tasks on a computer. Job levels Graduate, Mid-Professional, Professional Individual Contributor, Languages English (USA), Spanish, Portuguese (Brazil), French, Assessment length Approximate Completion Time in minutes = 7 Test Type: K"
